{
  "$defs": {
    "ProviderOperationState": {
      "enum": [
        "PENDING_SUBMIT",
        "SUBMITTED",
        "RUNNING",
        "SUCCEEDED",
        "FAILED",
        "CANCELLED",
        "UNKNOWN",
        "NOT_FOUND"
      ],
      "title": "ProviderOperationState",
      "type": "string"
    }
  },
  "$id": "urn:microdrama:contracts:1.6.0:ProviderOperation",
  "$schema": "https://json-schema.org/draft/2020-12/schema",
  "additionalProperties": false,
  "description": "Durable record of one external call (submit → status → reconcile).",
  "properties": {
    "attempt": {
      "default": 1,
      "minimum": 1,
      "title": "Attempt",
      "type": "integer"
    },
    "client_token": {
      "description": "Idempotency token sent to the provider",
      "maxLength": 500,
      "minLength": 1,
      "title": "Client Token",
      "type": "string"
    },
    "deadline_at": {
      "format": "date-time",
      "title": "Deadline At",
      "type": "string"
    },
    "external_id": {
      "anyOf": [
        {
          "maxLength": 500,
          "minLength": 1,
          "type": "string"
        },
        {
          "type": "null"
        }
      ],
      "default": null,
      "title": "External Id"
    },
    "job_id": {
      "anyOf": [
        {
          "format": "uuid",
          "type": "string"
        },
        {
          "type": "null"
        }
      ],
      "default": null,
      "title": "Job Id"
    },
    "operation_id": {
      "format": "uuid",
      "title": "Operation Id",
      "type": "string"
    },
    "operation_kind": {
      "pattern": "^[a-z0-9][a-z0-9_.\\-]{0,119}$",
      "title": "Operation Kind",
      "type": "string"
    },
    "provider": {
      "pattern": "^[a-z0-9][a-z0-9_.\\-]{0,119}$",
      "title": "Provider",
      "type": "string"
    },
    "request_sha256": {
      "description": "Lowercase SHA-256 hex",
      "pattern": "^[0-9a-f]{64}$",
      "title": "Request Sha256",
      "type": "string"
    },
    "reservation_id": {
      "anyOf": [
        {
          "format": "uuid",
          "type": "string"
        },
        {
          "type": "null"
        }
      ],
      "default": null,
      "title": "Reservation Id"
    },
    "schema_version": {
      "const": "1.0",
      "default": "1.0",
      "description": "Unsupported/stale versions are rejected",
      "title": "Schema Version",
      "type": "string"
    },
    "state": {
      "$ref": "#/$defs/ProviderOperationState"
    },
    "submitted_at": {
      "anyOf": [
        {
          "format": "date-time",
          "type": "string"
        },
        {
          "type": "null"
        }
      ],
      "default": null,
      "title": "Submitted At"
    }
  },
  "required": [
    "operation_id",
    "provider",
    "operation_kind",
    "client_token",
    "request_sha256",
    "state",
    "deadline_at"
  ],
  "title": "ProviderOperation",
  "type": "object"
}
